{
  "registryVersion": 1,
  "provisionalAssetTypes": [
    "seminar",
    "executive_education_as_program_class",
    "credential",
    "certification",
    "certificate_of_completion",
    "continuing_education_recognition",
    "organizational_certification",
    "digital_badge"
  ],
  "assessmentCategories": [
    "knowledge_check",
    "practice_activity",
    "formative_assessment",
    "summative_assessment",
    "competency_assessment",
    "practical_project_review",
    "capstone_evaluation",
    "organizational_outcome_verification",
    "credential_evaluation"
  ],
  "conceptualLearnerRecordTypes": [
    "learner",
    "organization",
    "organizational_unit_or_team",
    "cohort",
    "enrollment_or_participation",
    "program_assignment",
    "learning_pathway_assignment",
    "progress",
    "assessment_attempt",
    "evidence_submission",
    "feedback",
    "completion",
    "competency_verification",
    "credential_decision",
    "continuing_education_history"
  ],
  "records": [
    {
      "id": "ed-0001",
      "title": "Education & Workforce Development Foundation v1",
      "recordType": "governance_foundation",
      "educationalAssetType": "institutional_education_foundation",
      "provisionalDescriptors": [],
      "purpose": "Establish the authoritative initial education and workforce-development architecture.",
      "scope": "Definitions, doctrine, architecture, governance, classifications, lifecycles, boundaries, records, quality, traceability, and technical implementation limits.",
      "path": "institution/foundations/education/education-workforce-development-foundation-v1.md",
      "authoritativeSource": "institution/foundations/education/education-workforce-development-foundation-v1.md",
      "sourceSections": [
        "§§1–22"
      ],
      "version": "v1.0",
      "effectiveDate": null,
      "contentLifecycleState": "approved",
      "programMaturity": "not_applicable",
      "educationalAuthorityStatus": "authoritative",
      "readiness": {
        "educationalSubstanceApproval": "approved",
        "programApproval": "not_applicable",
        "deliveryReadiness": "not_applicable",
        "enrollmentAvailability": "not_applicable",
        "assessmentReadiness": "not_applicable",
        "credentialReadiness": "not_applicable",
        "publicDisclosureReadiness": "not_approved",
        "technologyImplementationReadiness": "approved",
        "legalAndOperationalReadiness": "not_applicable",
        "commercialReadiness": "not_applicable"
      },
      "disclosure": "internal",
      "audienceContexts": [
        "not_applicable"
      ],
      "deliveryModelCompatibility": [
        "not_applicable"
      ],
      "capabilityRelationships": [],
      "competencyRelationships": [],
      "methodologyRelationships": [],
      "ipRelationships": [],
      "knowledgeRelationships": [],
      "educationalAdaptations": [],
      "sourceVersionDependencies": [],
      "qualityMetadata": {
        "qualityReviewStatus": "source_approved",
        "reviewType": "education_room_source_approval",
        "reviewerAuthority": "Education & Workforce Development room (interim; configurable)",
        "reviewDate": null,
        "accuracyStatus": "preserved_verbatim_from_transmitted_source",
        "methodologicalFidelityStatus": "not_applicable_no_adaptation",
        "evidenceBasis": [
          "npm run validate:education"
        ],
        "requiredCorrectiveActions": [],
        "nextReviewCondition": "Material change to the Foundation source or to applicable institutional authority."
      },
      "evidenceMetadata": [
        "npm run validate:education",
        "git history"
      ],
      "knownLimitations": [
        "The formal approval and effective date were not transmitted; effectiveDate remains null pending Education & Workforce Development authority."
      ],
      "openQuestions": [
        "Final constitutional allocation of educational approval authority (EWDFv1 §20.1)."
      ],
      "unresolvedMatters": [
        "All EWDFv1 §21 matters remain intentionally incomplete and unapproved; their absence is never approval, rejection, delegation, or permission.",
        "Production learner, instructor, assessment, organizational, and participation data remains blocked pending privacy and legal governance (EWDFv1 §14.5, §20.10)."
      ],
      "authority": {
        "authorityBasis": "Education & Workforce Development room's approved institutional authority (EWDFv1 §1.3, §18.1); determination \"EDUCATION PLATFORM FOUNDATION READY FOR TECHNICAL IMPLEMENTATION\".",
        "approvingAuthority": {
          "basis": "Interim rule (EWDFv1 §12.3): educational governance approvals recorded under the Education & Workforce Development room; stored as data, never as a technical permission.",
          "configurable": true,
          "subordinateTo": "The Constitution and any later-approved institutional decision-rights architecture."
        },
        "substantiveAuthority": "Education & Workforce Development room",
        "constitutionalSubordination": true
      },
      "approvalHistory": [
        {
          "action": "initial_approval",
          "authority": "Education & Workforce Development room",
          "basis": "EWDFv1 §18 record definition transmitted with the implementing authorization; governance-record creation only — no program, offering, delivery, enrollment, disclosure, or credential authorization.",
          "date": null
        }
      ],
      "dependencies": [
        "Vision",
        "Constitution",
        "Methodology",
        "Intellectual Property",
        "Institutional Knowledge Architecture"
      ],
      "relatedRecords": [
        "ed-0002",
        "ed-0003",
        "ed-0004",
        "ed-0005",
        "ed-0006",
        "ed-0007",
        "ed-0008",
        "ed-0009",
        "ed-0010",
        "ed-0011",
        "ed-0012"
      ],
      "supersedes": null,
      "supersededBy": null,
      "retirementStatus": "not_retired",
      "archivalStatus": "active",
      "historicalVersions": [],
      "changeRationale": "Initial record creation from Education & Workforce Development Foundation v1.",
      "governingReferences": [
        "institution/foundations/education/education-workforce-development-foundation-v1.md",
        "institution/technical/education-platform-architecture.md",
        "institution/governance/constitution/huerta-group-constitution.md",
        "institution/governance/strategic/vision-foundation-for-development.md"
      ],
      "technicalImplementationAuthorization": true,
      "containsSubstantiveEducationalRequirements": true
    },
    {
      "id": "ed-0002",
      "title": "Education Definition and Scope Standard v1",
      "recordType": "governance_record",
      "educationalAssetType": "education_governance_standard",
      "provisionalDescriptors": [],
      "purpose": "Define education, workforce development, capability development, competency-based learning, organizational education, professional education, and knowledge transfer.",
      "scope": "Terminology, institutional relationships, exclusions, and authority boundaries.",
      "path": "institution/foundations/education/records/ed-0002-education-definition-and-scope-standard-v1.md",
      "authoritativeSource": "institution/foundations/education/education-workforce-development-foundation-v1.md",
      "sourceSections": [
        "§2",
        "§18.2"
      ],
      "version": "v1.0",
      "effectiveDate": null,
      "contentLifecycleState": "approved",
      "programMaturity": "not_applicable",
      "educationalAuthorityStatus": "authoritative",
      "readiness": {
        "educationalSubstanceApproval": "approved",
        "programApproval": "not_applicable",
        "deliveryReadiness": "not_applicable",
        "enrollmentAvailability": "not_applicable",
        "assessmentReadiness": "not_applicable",
        "credentialReadiness": "not_applicable",
        "publicDisclosureReadiness": "not_approved",
        "technologyImplementationReadiness": "approved",
        "legalAndOperationalReadiness": "not_applicable",
        "commercialReadiness": "not_applicable"
      },
      "disclosure": "internal",
      "audienceContexts": [
        "not_applicable"
      ],
      "deliveryModelCompatibility": [
        "not_applicable"
      ],
      "capabilityRelationships": [],
      "competencyRelationships": [],
      "methodologyRelationships": [],
      "ipRelationships": [],
      "knowledgeRelationships": [],
      "educationalAdaptations": [],
      "sourceVersionDependencies": [
        {
          "target": "institution/foundations/education/education-workforce-development-foundation-v1.md",
          "nature": "version_dependency",
          "sourceVersion": "v1.0",
          "note": "A Foundation update triggers governed review of this record, never automatic modification (EWDFv1 §17.4)."
        }
      ],
      "qualityMetadata": {
        "qualityReviewStatus": "source_approved",
        "reviewType": "education_room_source_approval",
        "reviewerAuthority": "Education & Workforce Development room (interim; configurable)",
        "reviewDate": null,
        "accuracyStatus": "traceable_to_source_sections",
        "methodologicalFidelityStatus": "not_applicable_no_adaptation",
        "evidenceBasis": [
          "npm run validate:education"
        ],
        "requiredCorrectiveActions": [],
        "nextReviewCondition": "Material change to the Foundation source or to applicable institutional authority."
      },
      "evidenceMetadata": [
        "npm run validate:education",
        "git history"
      ],
      "knownLimitations": [
        "Summary record: Foundation §2 is authoritative and corrects this record wherever they differ."
      ],
      "openQuestions": [],
      "unresolvedMatters": [],
      "authority": {